"level";"id";"parent_id";"object_id";"object_type";"object_key";"query_status";"query_time";"query_type";"message";"created_time";"updated_time";"error.message"
"1";"173";"6";"45235597147_1016198110540825";"data";"data.*";"fetched (200)";"2025-04-22 07:21:48.068609";"Facebook:/<page-id>/posts";"🌧️💙 Unidos por la niñez en el departamento del Chocó.  En medio de las afectaciones psicosociales causadas por las recientes inundaciones, estamos apoyando la recuperación emocional de más de 250 niños, niñas y adolescentes indígenas y afro en Bellavista, Pogue y Puerto Antioquia (Bojayá).  A través de actividades de primeros auxilios psicológicos, mensajes clave de protección y prevención de riesgos, seguimos construyendo esperanza. ✨ ¡Nuestro objetivo! Llegar a otros 1.000 niños y niñas en Bojayá y el Alto y Medio Baudó.  #UNICEFEnAcción";"2024-12-19T15:02:26+0000";"2024-12-19T15:02:26+0000";""
"1";"174";"6";"45235597147_1015401647287138";"data";"data.*";"fetched (200)";"2025-04-22 07:21:48.068609";"Facebook:/<page-id>/posts";"Las niñas, niños y adolescentes migrantes enfrentan innumerables desafíos en su ruta: no tienen siempre un refugio seguro o acceso a servicios básicos, sufren dificultades económicas, dejan de estudiar y se exponen a violencia y condiciones adversas.   Caminan por un mejor futuro, huyendo de dificultades en sus propios países.   Hoy, en el #DíadelMigrante, recordamos que siempre las personas migrantes viajan con sus derechos. Es vital adoptar con urgencia políticas migratorias amigables para la niñez e implementar respuestas humanitarias más sólidas, incluyendo el fortalecimiento de los servicios de salud y protección infantil específicos para cada edad y con enfoque de género.    Trabajemos juntos para garantizar que todos los niños, niñas y adolescentes tengan un futuro digno, sin importar de dónde provengan 🎒   #DíaDelMigrante";"2024-12-18T14:48:08+0000";"2024-12-18T14:48:08+0000";""
"1";"175";"6";"45235597147_1014899187337384";"data";"data.*";"fetched (200)";"2025-04-22 07:21:48.068609";"Facebook:/<page-id>/posts";"¿Recuerdas cómo comenzó tu educación? todo empezó cuando aprendiste a leer. Ayuda a que los niños y niñas del Catatumbo también tengan esa oportunidad. Con una donación desde $3.000 en nuestra vaki, puedes garantizar su educación 📖📚. https://s.mtrbio.com/bpghuejknt";"2024-12-17T23:02:19+0000";"2024-12-17T23:02:19+0000";""
"1";"176";"6";"45235597147_1014625457364757";"data";"data.*";"fetched (200)";"2025-04-22 07:21:48.068609";"Facebook:/<page-id>/posts";"🗯 “Tener ese apoyo familiar lo ayuda a uno a seguir adelante, a seguir luchando y nunca rendirse.”  Conoce la historia de vida de Melanny, quien, desde Saravena, departamento de Arauca, nos cuenta cómo el apoyo emocional y la comprensión pueden marcar una diferencia positiva en la vida de los más jóvenes. 💙  🎥 Este video forma parte de nuestra campaña #AbrazaTuMente, que busca romper los estigmas y mitos sobre la salud mental, especialmente en niños, niñas y adolescentes. Conoce más en https://s.mtrbio.com/dvyzrhjuzh";"2024-12-17T14:03:04+0000";"2024-12-17T14:03:04+0000";""
"1";"177";"6";"45235597147_1014070054086964";"data";"data.*";"fetched (200)";"2025-04-22 07:21:48.068609";"Facebook:/<page-id>/posts";"La escuela puede ser tu lugar seguro, donde aprendes y te diviertes. Por eso, #AúnEstásATiempo para asegurar tu cupo en la temporada de #Matrículas2024. Recuerda que este proceso es gratuito para el sistema oficial. Infórmate aquí 👉 https://s.mtrbio.com/klgfiqdral Ministerio de Educación Nacional de Colombia";"2024-12-16T18:02:48+0000";"2025-01-04T06:03:42+0000";""
"1";"178";"6";"45235597147_1013951727432130";"data";"data.*";"fetched (200)";"2025-04-22 07:21:48.068609";"Facebook:/<page-id>/posts";"En respuesta a la emergencia por inundaciones, seguimos trabajando de la mano con la comunidad de San Lorenzo, en Nóvita, Chocó, para garantizar su bienestar.  En colaboración con la Alcaldía, la Gobernación, la UNGRD, los Bomberos y la Defensa Civil, entregamos 130 kits de aseo y 130 kits de alimentos. Además, realizamos talleres sobre prácticas de higiene y el uso adecuado de los insumos entregados, contribuyendo a la protección de la salud de niñas, niños, adolescentes y sus familias.  En paralelo, continuamos monitoreando la calidad del agua y tomando muestras, para asegurar que las familias tengan acceso a agua segura.  Nuestro compromiso es apoyar a las comunidades afectadas, sin importar dónde se encuentren, para promover el bienestar de la niñez y sus familias. 💧🤝  #UNICEFenAcción";"2024-12-16T14:35:47+0000";"2024-12-16T14:35:47+0000";""
"1";"179";"6";"45235597147_1012497460910890";"data";"data.*";"fetched (200)";"2025-04-22 07:21:48.068609";"Facebook:/<page-id>/posts";"Para Nicoll, el #ImpulsoJuvenil es hablar de paz por medio de la serigrafía y el bordado. Así es como ella y otros jóvenes del Catatumbo transforman su territorio 🙌   Este proyecto, junto a UNODC Región Andina y Cono Sur y #FAO busca aumentar la participación e incidencia de las y los jóvenes en la protección de sus derechos, así como promover agendas juveniles en los planes de desarrollo a nivel local, departamental y nacional para contribuir a la construcción de una paz sostenible y duradera, con apoyo de United Nations Peacebuilding y el Fondo Multidonante de las Naciones Unidas para la Paz.";"2024-12-14T14:02:27+0000";"2024-12-14T14:02:27+0000";""
"1";"180";"6";"45235597147_1011365284357441";"data";"data.*";"fetched (200)";"2025-04-22 07:21:48.068609";"Facebook:/<page-id>/posts";"La negligencia y el abandono también son formas de violencia contra la niñez. 🚫   Ellos y ellas dicen #TrátameAlDerecho: en hogares, escuelas y comunidades podemos sumarnos para darle la vuelta a esta realidad.";"2024-12-12T21:06:46+0000";"2024-12-12T21:06:46+0000";""
"1";"181";"6";"45235597147_1010656701094966";"data";"data.*";"fetched (200)";"2025-04-22 07:21:48.068609";"Facebook:/<page-id>/posts";"¡78 años trabajando por los derechos de la niñez!   Hoy celebramos el cumpleaños de UNICEF y ratificamos nuestro compromiso para seguir trabajando todos los días por el bienestar de la infancia: para garantizar sus derechos sin importar su condición o el lugar donde se encuentren.   Cada año, más aliados y socios se suman a esta causa para garantizar que niñas, niños y adolescentes tengan una oportunidad justa y crezcan en condiciones que les permitan alcanzar todo su potencial.  #78AñosDeUNICEF";"2024-12-11T20:14:27+0000";"2025-01-06T12:48:59+0000";""
"1";"182";"6";"45235597147_1010071967820106";"data";"data.*";"fetched (200)";"2025-04-22 07:21:48.068609";"Facebook:/<page-id>/posts";"📢 Hoy celebramos el Día de los Derechos Humanos 🌎✨  En UNICEF Colombia, reafirmamos nuestro compromiso de trabajar cada día por los derechos de cada niño, niña y adolescente. 💙  🌟 Derechos como el acceso a la educación, la salud, la protección y la participación son fundamentales para construir un futuro justo y sostenible.";"2024-12-10T22:51:32+0000";"2024-12-10T22:51:32+0000";""
"1";"183";"6";"45235597147_1009131984580771";"data";"data.*";"fetched (200)";"2025-04-22 07:21:48.068609";"Facebook:/<page-id>/posts";"¿Sabías que el juego no solo es divertido, fomenta la imaginación y el disfrute, sino que también ayuda a los niños y niñas a gestionar emociones difíciles? ​🧒🏻👦🏽  🛝🧩 A través del juego, los niños aprenden a expresar sus sentimientos, desarrollar empatía y encontrar soluciones creativas a sus problemas.";"2024-12-09T15:02:53+0000";"2024-12-09T15:02:53+0000";""
"1";"184";"6";"45235597147_1008342137993089";"data";"data.*";"fetched (200)";"2025-04-22 07:21:48.068609";"Facebook:/<page-id>/posts";"Ninguna forma de violencia es justificada. La violencia en la niñez no solo afecta el presente, sino que deja secuelas que se extienden a lo largo de la vida, generando efectos psicológicos, emocionales y sociales devastadores. Esta realidad no debe ser ignorada.   Conoce más recursos y consejos para que trabajemos juntos para eliminar la violencia contra la niñez en tratamealderecho.com  #TrátameAlDerecho";"2024-12-08T12:30:27+0000";"2024-12-08T12:30:27+0000";""
"1";"185";"6";"45235597147_1008002104693759";"data";"data.*";"fetched (200)";"2025-04-22 07:21:48.068609";"Facebook:/<page-id>/posts";"La pólvora no es un juego.  Durante estas fiestas, asegurémonos que las niñas y niños disfruten sin riesgos. Supervisa y acompaña siempre a tus hijos e hijas.  ➡️No permitas que usen pólvora. ➡️Opta por alternativas seguras para celebrar.  La seguridad y cuidado de las niñas y niños está en nuestras manos. ¡Aseguremos que estas sean fechas felices en familia!  #DíaDeLasVelitas #NiñezSegura #CeroPólvora";"2024-12-08T00:30:29+0000";"2024-12-08T00:30:29+0000";""
"1";"186";"6";"45235597147_1007694704724499";"data";"data.*";"fetched (200)";"2025-04-22 07:21:48.068609";"Facebook:/<page-id>/posts";"🌍💚 El cambio climático representa una amenaza global para todos y todas, pero son las niñas, niños y adolescentes quienes enfrentan los mayores desafíos.   Por eso, desde UNICEF Colombia trabajamos para generar espacios activos de participación donde sus voces sean escuchadas y sus propuestas de acción climática sean una prioridad.   ¡Es momento de escuchar a la juventud y actuar juntos por un futuro sostenible! 🌱✨     #AcciónClimática #CambioClimático";"2024-12-07T14:02:22+0000";"2024-12-07T16:31:42+0000";""
"1";"187";"6";"45235597147_1007224534771516";"data";"data.*";"fetched (200)";"2025-04-22 07:21:48.068609";"Facebook:/<page-id>/posts";"Haz que aprender a leer y a escribir deje de darles miedo y se convierta en su realidad. En nuestra Vaki podrás donar por ellos y ellas y recibir un agradecimiento único de su parte.  ¡Dona ahora! 🤗📥 https://s.mtrbio.com/ciqukazhom";"2024-12-06T23:01:42+0000";"2024-12-06T23:01:42+0000";""
"1";"188";"6";"45235597147_1006579841502652";"data";"data.*";"fetched (200)";"2025-04-22 07:21:48.068609";"Facebook:/<page-id>/posts";"Durante los #16DíasDeActivismoContraLaViolenciaDeGénero desde UNICEF Colombia hacemos un llamado a proteger la vida y la dignidad de las niñas y adolescentes.    Promover la igualdad, educar sobre el consentimiento y brindar apoyo a las víctimas y sobrevivientes son pasos esenciales para erradicar este tipo de violencia.   Actúa, denuncia y comparte este mensaje.   #ParaCadaNiña #NoHayExcusa #TrátameAlDerecho";"2024-12-06T01:01:48+0000";"2024-12-06T01:01:48+0000";""
"1";"189";"6";"45235597147_1006430358184267";"data";"data.*";"fetched (200)";"2025-04-22 07:21:48.068609";"Facebook:/<page-id>/posts";"¡Cuando escuchamos las voces de la niñez y la juventud, y sus reflexiones acerca de la reconciliación confirmamos que la paz es una meta alcanzable si la construimos entre todas y todos!   Más de 700 jóvenes participaron en la segunda edición de Trazos de Paz, el concurso de UNICEF y la Comisión de la Verdad, que reconoce que los adolescentes y jóvenes son esenciales para promover memoria y reconciliación.   Conoce las 20 obras ganadoras en la galería virtual del concurso: https://s.mtrbio.com/giydtdakjk";"2024-12-05T19:01:59+0000";"2024-12-05T19:01:59+0000";""
"1";"190";"6";"45235597147_1005786428248660";"data";"data.*";"fetched (200)";"2025-04-22 07:21:48.068609";"Facebook:/<page-id>/posts";"¡Los jóvenes tienen el potencial de transformar sus territorios! Humberto y otros adolescentes del Catatumbo nos comparten sus iniciativas como parte de #ImpulsoJuvenil 🙌  Este proyecto, junto a UNODC Región Andina y Cono Sur y #FAO, busca aumentar la participación e incidencia de los jóvenes en la protección de sus derechos, así como promover agendas juveniles en los planes de desarrollo a nivel local, departamental y nacional para contribuir a la construcción de una paz sostenible y duradera, con apoyo de United Nations Peacebuilding  y el Fondo Multidonante de las Naciones Unidas para la Paz.";"2024-12-04T19:49:13+0000";"2024-12-04T19:49:13+0000";""
"1";"191";"6";"45235597147_1005066164987353";"data";"data.*";"fetched (200)";"2025-04-22 07:21:48.068609";"Facebook:/<page-id>/posts";"✍️ A propósito del #DíaInternacionalDeLasPersonasConDiscapacidad recordamos que la inclusión y la educación es un derecho para cada niño, niña y adolescente, sin importar su condición.   🙋‍♂️Así nos lo recuerda Sebastián, quien comparte su experiencia de inclusión como representante del Concejo de Niñas y Niños de Barranquilla: este es su mensaje para las escuelas del país.";"2024-12-03T23:01:57+0000";"2024-12-03T23:01:57+0000";""
"1";"192";"6";"45235597147_1004867755007194";"data";"data.*";"fetched (200)";"2025-04-22 07:21:48.068609";"Facebook:/<page-id>/posts";"Hoy, en el Día Internacional de las Personas con Discapacidad, celebramos el derecho de todas las niñas y todos los niños de Colombia a vivir en una sociedad inclusiva, diversa y respetuosa. 🙌  #DíaInternacionalDeLasPersonasConDiscapacidad #PorLaInclusión #SinDiscriminación #ColombiaIncluyente";"2024-12-03T16:25:15+0000";"2024-12-03T17:06:48+0000";""
"1";"193";"6";"45235597147_1004333431727293";"data";"data.*";"fetched (200)";"2025-04-22 07:21:48.068609";"Facebook:/<page-id>/posts";"A veces olvidamos que, para cuidar de otras personas, primero debemos cuidarnos a nosotros mismos. Por eso hoy te traemos 4 consejos de la mano de Natalia Jerez, embajadora nacional de UNICEF Colombia, para priorizar tu salud y adoptar prácticas de crianza positiva.  👉 Encuentra más herramientas y recursos en https://s.mtrbio.com/ofozidlbwr  #TrátameAlDerecho | #DíaMundialDeLaInfancia";"2024-12-02T23:02:27+0000";"2024-12-02T23:02:27+0000";""
"1";"194";"6";"unicefcolombia";"offcut";"";"fetched (200)";"2025-04-22 07:21:48.068609";"Facebook:/<page-id>/posts";"";"";"";""
"1";"195";"7";"301178233334429_1029724092519426";"data";"data.*";"fetched (200)";"2025-04-22 07:21:49.140007";"Facebook:/<page-id>/posts";"📌#DeInterés | Migración Colombia aplica medida de inadmisión a dos ciudadanos nepalíes que fueron detectados en las salas internacionales del Aeropuerto Internacional El Dorado con pasaportes de Malasia falsos.";"2024-12-30T22:04:58+0000";"2024-12-30T22:04:58+0000";""
"1";"196";"7";"301178233334429_1022468933244942";"data";"data.*";"fetched (200)";"2025-04-22 07:21:49.140007";"Facebook:/<page-id>/posts";"Con el objetivo de construir espacios de participación más incluyentes y que reduzcan las brechas a la población con discapacidad, adelantamos en el Aeropuerto Internacional El Dorado la primera mesa de participación ciudadana enfocada en Personas con Discapacidad.";"2024-12-20T20:30:02+0000";"2025-01-05T20:14:30+0000";""
"1";"197";"7";"301178233334429_1022443019914200";"data";"data.*";"fetched (200)";"2025-04-22 07:21:49.140007";"Facebook:/<page-id>/posts";"Con la participación de los consejos comunitarios de comunidades negras, resguardos indígenas de los pueblos Embera, Zenú y Gunadule, migrantes, comunidad local y el Gobierno nacional; los #DiálogosFronterizosPorLaVida, de Migración Colombia, se desarrollan con éxito en Acandí. 🙌🇨🇴";"2024-12-20T19:32:50+0000";"2025-01-12T22:18:51+0000";""
"1";"198";"7";"301178233334429_1022315783260257";"data";"data.*";"fetched (200)";"2025-04-22 07:21:49.140007";"Facebook:/<page-id>/posts";"Nuestros equipos de respuesta están preparados para brindarle apoyo a las víctimas de #TrataDePersonas en tiempo real, una vez se recibe un reporte. #PulsaElBotón con responsabilidad, con tu ayuda combatimos este delito.";"2024-12-20T15:30:59+0000";"2024-12-20T15:30:59+0000";""
"1";"199";"7";"301178233334429_1021740606651108";"data";"data.*";"fetched (200)";"2025-04-22 07:21:49.140007";"Facebook:/<page-id>/posts";"A pesar de los esfuerzos del Gobierno nacional, miles de personas siguen cayendo en las redes de #TrataDePersonas. Niñas, adolescentes y mujeres jóvenes son las víctimas más vulnerables de personas que explotan sus sueños y convierten sus cuerpos en mercancía. #NoEsUnPaseo";"2024-12-19T21:24:00+0000";"2024-12-27T16:33:58+0000";""
"1";"200";"7";"301178233334429_1021718749986627";"data";"data.*";"fetched (200)";"2025-04-22 07:21:49.140007";"Facebook:/<page-id>/posts";"#FelicesFiestasyFelicesViajes | Con #CheckMig cargas de manera anticipada la información de tu vuelo y optimizas el tiempo en el proceso de entrevista con el oficial de Migración Colombia.   🔵 Recuerda que no es obligatorio. Realízalo sin costo aquí 👇🏼 https://apps.migracioncolombia.gov.co/pre-registro/";"2024-12-19T20:30:03+0000";"2024-12-28T23:28:18+0000";""
"1";"201";"7";"301178233334429_1021692583322577";"data";"data.*";"fetched (200)";"2025-04-22 07:21:49.140007";"Facebook:/<page-id>/posts";"#GanaTiempoGanaMillas  Hasta el próximo 30 de enero las colombianas y colombianos que se registren en #Biomig en el Aeropuerto Internacional El Dorado, el Aeropuerto Internacional José María Córdova y el Aeropuerto Internacional Rafael Núñez de Cartagena de Indias, recibirán USD 25 o 5.000 millas, redimibles en vuelos internacionales de Avianca.";"2024-12-19T19:31:04+0000";"2024-12-19T19:31:04+0000";""
"1";"202";"7";"301178233334429_1021597016665467";"data";"data.*";"fetched (200)";"2025-04-22 07:21:49.140007";"Facebook:/<page-id>/posts";"Desde Migración Colombia queremos desearte #FelicesFiestasyFelicesViajes.   Para poder resolver cualquier eventualidad, durante la temporada de #FinDeAño preséntate al control migratorio con 4 horas de anticipación a tu vuelo.";"2024-12-19T16:30:02+0000";"2024-12-19T16:30:02+0000";""
"1";"203";"7";"301178233334429_1021548363336999";"data";"data.*";"fetched (200)";"2025-04-22 07:21:49.140007";"Facebook:/<page-id>/posts";"Los #DiálogosFronterizosPorLaVida de Migración Colombia regresan a Acandí este viernes 20 de diciembre desde las 8:30 de la mañana en el Hotel David Plaza.   Participa en este espacio de diálogo y construcción de soluciones junto a tu comunidad y el #GobiernoDelCambio.";"2024-12-19T15:16:19+0000";"2024-12-19T21:31:05+0000";""
"1";"204";"7";"301178233334429_1021501403341695";"data";"data.*";"fetched (200)";"2025-04-22 07:21:49.140007";"Facebook:/<page-id>/posts";"#FelicesFiestasyFelicesViajes | 5️⃣ cosas que debes tener en cuenta si sales del país en compañía de #MenoresDeEdad👫 durante esta temporada de #FinDeAño👇🏼";"2024-12-19T14:01:34+0000";"2025-01-08T17:52:22+0000";""
"1";"205";"7";"301178233334429_1020885570069945";"data";"data.*";"fetched (200)";"2025-04-22 07:21:49.140007";"Facebook:/<page-id>/posts";"Más de 100 asistentes de la sociedad civil, migrantes, representantes de 15 asociaciones afro, consejos comunitarios y entidades del #GobiernoDelCambio como Presidencia de la República, Departamento Nacional de Planeación - DNP, Instituto Colombiano de Bienestar Familiar ICBF celebraron con éxito los #DiálogosFronterizosPorLavida hoy en Necoclí.";"2024-12-18T22:00:17+0000";"2024-12-18T22:00:17+0000";""
"1";"206";"7";"301178233334429_1020861496739019";"data";"data.*";"fetched (200)";"2025-04-22 07:21:49.140007";"Facebook:/<page-id>/posts";"En el #DíaInternacionalDelMigrante queremos destacar el valor de la migración como motor para el desarrollo. Como hijo de inmigrantes colombianos, David, un español estudiante de medicina, quiere poner su granito de arena.";"2024-12-18T21:01:10+0000";"2025-03-01T14:24:30+0000";""
"1";"207";"7";"301178233334429_1020839890074513";"data";"data.*";"fetched (200)";"2025-04-22 07:21:49.140007";"Facebook:/<page-id>/posts";"Durante la celebración del #DíaInternacionalDelMigrante en Ipiales (Nariño) conocimos a Maribel, una venezolana que piensa que, aunque los procesos de integración pueden ser difíciles, como migrante se puede marcar la diferencia “en lo bonito”.";"2024-12-18T20:15:24+0000";"2024-12-18T20:15:24+0000";""
"1";"208";"7";"301178233334429_1020817256743443";"data";"data.*";"fetched (200)";"2025-04-22 07:21:49.140007";"Facebook:/<page-id>/posts";"Los #MenoresDeEdad👫 que viajan solos, con un tercero o con sólo uno de sus padres deben presentar el #PermisoDeSalida notariado.   Encuentra todas las recomendaciones de viaje para niños, niñas y adolescentes aquí 👇🏼 https://www.migracioncolombia.gov.co/entidad/salida-de-menores-del-pais";"2024-12-18T19:30:03+0000";"2024-12-19T06:40:08+0000";""
"1";"209";"7";"301178233334429_1020737383418097";"data";"data.*";"fetched (200)";"2025-04-22 07:21:49.140007";"Facebook:/<page-id>/posts";"En el marco de la conmemoración del #DíaInternacionalDelMigrante, nuestra Regional Nariño - Putumayo lideró un encuentro binacional para acercar la institucionalidad a migrantes y comunidades de acogida y promover la integración en la frontera colombo-ecuatoriana.";"2024-12-18T17:00:45+0000";"2024-12-18T22:07:45+0000";""
"1";"210";"7";"301178233334429_1020691040089398";"data";"data.*";"fetched (200)";"2025-04-22 07:21:49.140007";"Facebook:/<page-id>/posts";"🚨 #Atención Necoclí  Tenemos una cita hoy, desde las 8:30 a.m., en el colegio del corregimiento El Totumo para realizar los #DiálogosFronterizosPorLavida de Migración Colombia.   Construyamos juntos las soluciones para las principales problemáticas de tu región.";"2024-12-18T15:36:36+0000";"2024-12-18T20:48:30+0000";""
"1";"211";"7";"301178233334429_1020628850095617";"data";"data.*";"fetched (200)";"2025-04-22 07:21:49.140007";"Facebook:/<page-id>/posts";"#DeInterés | Migración Colombia deja a disposición de Policía Nacional de los Colombianos, en el Aeropuerto Internacional Alfonso Bonilla Aragón, a un colombiano requerido por el delito de homicidio. El ciudadano fue retenido por nuestros oficiales cuando pretendía salir del país con destino a España.";"2024-12-18T14:00:13+0000";"2024-12-18T14:00:13+0000";""
"1";"212";"7";"301178233334429_1020123246812844";"data";"data.*";"fetched (200)";"2025-04-22 07:21:49.140007";"Facebook:/<page-id>/posts";"En Aeropuerto Internacional El Dorado dejamos a disposición de Policía Nacional de los Colombianos a un colombiano que llegó en calidad de deportado.   Durante el control migratorio nuestros oficiales detectaron que se identificaba con una cédula falsa, por lo que tendrá que afrontar cargos por falsedad de documento.";"2024-12-17T22:10:03+0000";"2024-12-30T14:27:29+0000";""
"1";"213";"7";"301178233334429_1020094740149028";"data";"data.*";"fetched (200)";"2025-04-22 07:21:49.140007";"Facebook:/<page-id>/posts";"Para llegar a Estados Unidos Celeste tomó una lancha, junto a 18 personas, desde San Andrés hasta Nicaragua. Unos conocidos le habían dicho que era la ruta más fácil, pero debido al sobrepeso la embarcación naufragó minutos después. Ella fue la única sobreviviente.  #NoEsUnPaseo";"2024-12-17T21:00:42+0000";"2024-12-17T21:00:42+0000";""
"1";"214";"7";"301178233334429_1020076050150897";"data";"data.*";"fetched (200)";"2025-04-22 07:21:49.140007";"Facebook:/<page-id>/posts";"Hacemos equipo con Armada de Colombia, la Alcaldía de Santa Marta D.T.C.H., Policía Nacional de los Colombianos, Parques Nacionales Naturales de Colombia y Corporación Autónoma Regional del Magdalena-Corpamag, para realizar labores de patrullaje, control y verificación en aguas de la bahía de Santa Marta.";"2024-12-17T20:15:02+0000";"2024-12-17T20:15:02+0000";""
"1";"215";"7";"301178233334429_1020041350154367";"data";"data.*";"fetched (200)";"2025-04-22 07:21:49.140007";"Facebook:/<page-id>/posts";"Gracias al reporte de una empresa transportadora en nuestra plataforma #SIRE, oficiales de Migración Colombia de Valledupar interceptaron en bus intermunicipal que viajaba con destino a Bogotá a un ciudadano venezolano con orden de captura por el delito de hurto.";"2024-12-17T19:00:39+0000";"2025-03-11T15:21:30+0000";""
"1";"216";"7";"301178233334429_1019982906826878";"data";"data.*";"fetched (200)";"2025-04-22 07:21:49.140007";"Facebook:/<page-id>/posts";"#FelicesFiestasyFelicesViajes | En está temporada queremos regalarte más tiempo para tu familia.   Con #Biomig evitas las filas y haces migración más rápido.   Disponible para el ingreso y salida de colombianos y la salida de extranjeros en los principales aeropuertos del país.";"2024-12-17T17:00:42+0000";"2024-12-18T15:39:31+0000";""
"1";"217";"7";"301178233334429_1019931930165309";"data";"data.*";"fetched (200)";"2025-04-22 07:21:49.140007";"Facebook:/<page-id>/posts";"🚨 #Atención Necoclí  Tenemos una cita este miércoles 18 de diciembre desde las 8:30 a.m. para realizar los #DiálogosFronterizosPorLaVida de Migración Colombia.   Construyamos juntos las soluciones para las principales problemáticas de tu región.";"2024-12-17T15:31:19+0000";"2024-12-17T15:31:19+0000";""
"1";"218";"7";"301178233334429_1019410860217416";"data";"data.*";"fetched (200)";"2025-04-22 07:21:49.140007";"Facebook:/<page-id>/posts";"#FelicesFiestasyFelicesViajes | En está temporada queremos regalarte más tiempo para tu familia.   Con #Biomig evitas las filas y haces migración más rápido.   Disponible para el ingreso y salida de colombianos y la salida de extranjeros en los principales aeropuertos del país.";"2024-12-16T23:00:04+0000";"2024-12-17T01:27:51+0000";""
"1";"219";"7";"301178233334429_1019369483554887";"data";"data.*";"fetched (200)";"2025-04-22 07:21:49.140007";"Facebook:/<page-id>/posts";"El Cuerpo Consular de Cartagena de Indias resaltó la gestión y el compromiso de Migración Colombia en servicio de la seguridad de la ciudad amurallada, reconociendo a nuestro director regional Caribe, Dolcey de los Reyes, la Orden Civil del Mercurio en el grado de COMENDADOR.";"2024-12-16T21:15:02+0000";"2024-12-17T01:27:46+0000";""
