"level";"id";"parent_id";"object_id";"object_type";"object_key";"query_status";"query_time";"query_type";"message";"created_time";"updated_time";"error.message"
"1";"99";"3";"100509102964077_555884040745314";"data";"data.*";"fetched (200)";"2025-04-22 07:21:44.406815";"Facebook:/<page-id>/posts";"Seguimos cumpliéndole al país. Esta vez desde Letica donde presentamos el Sistema Nacional de Cuidado, en 11 ciudades socializamos a líderes de 23 barras populares de fútbol y se realizó un convenio con la Universidad Pegadógica para la ejecucion de proyectos comunitarios.   Estas algunas noticias de la semana en nuestro Top 5.  Comenta y comparte este vídeo y que el Cuidado en Colombia 🇨🇴 siempre se haga con condiciones dignas.";"2024-12-14T15:00:28+0000";"2024-12-19T02:58:56+0000";""
"1";"100";"3";"100509102964077_555314344135617";"data";"data.*";"fetched (200)";"2025-04-22 07:21:44.406815";"Facebook:/<page-id>/posts";"Mujeres que cuidan del territorio, de sus comunidades y del conocimiento ancestral que les permite seguir siendo guardianas del río y la selva.   Conozcamos más sobre las comunidades de cuidadoras y cuidadores a las que beneficiará la Ruta Fluvial del Cuidado.  Francia Márquez Vicepresidencia de la República de Colombia Instituto Colombiano de Bienestar Familiar ICBF ONU Mujeres RTVC Sistema de Medios Públicos";"2024-12-13T19:03:32+0000";"2025-01-02T23:55:33+0000";""
"1";"101";"3";"MinIgualdadCol";"offcut";"";"fetched (200)";"2025-04-22 07:21:44.406815";"Facebook:/<page-id>/posts";"";"";"";""
"1";"102";"4";"1783566445269444_1006291648209210";"data";"data.*";"fetched (200)";"2025-04-22 07:21:45.853274";"Facebook:/<page-id>/posts";"💙 Acoger a personas refugiadas. 💙 Amplificar sus voces. 💙 Hacerles saber que no están solas.  Un mundo más amable es un mundo más feliz. Sé amable.";"2024-12-30T16:21:02+0000";"2024-12-30T16:21:02+0000";""
"1";"103";"4";"1783566445269444_1003536665151375";"data";"data.*";"fetched (200)";"2025-04-22 07:21:45.853274";"Facebook:/<page-id>/posts";"Celebramos el esfuerzo y dedicación de 24 profesores de zonas rurales y urbanas de Arauca y Arauquita, quienes culminaron con éxito el Diplomado en Movilidad Humana. 👩‍🏫👨‍🏫  Esta iniciativa, liderada por ACNUR y la Defensoría del Pueblo Defensoría del Pueblo de Colombia tiene como propósito fortalecer las capacidades de docentes que día a día trabajan en contextos desafiantes, brindando educación y apoyo a las comunidades. 🌎📚  #ConlosRefugiadosyDesplazados";"2024-12-26T17:56:09+0000";"2024-12-26T17:56:09+0000";""
"1";"104";"4";"1783566445269444_993197109518664";"data";"data.*";"fetched (200)";"2025-04-22 07:21:45.853274";"Facebook:/<page-id>/posts";"📍Cali  🎉 La Institución Educativa Llano Verde se vistió de gala para celebrar los logros y la unión entre estudiantes, docentes y familias en torno a la protección de la niñez durante el 2024.  Acciones de fortalecimiento comunitario logradas junto a Save the Children Colombia  🤝";"2024-12-12T17:42:42+0000";"2024-12-19T19:38:44+0000";""
"1";"105";"4";"1783566445269444_992398246265217";"data";"data.*";"fetched (200)";"2025-04-22 07:21:45.853274";"Facebook:/<page-id>/posts";"Un momento histórico. El Proceso de Cartagena cumple 40 años. Únete al evento para conocer la hoja de ruta de los próximos 10 años para seguir protegiendo de personas refugiadas y desplazadas en América Latina y el Caribe. #cartagena40  https://www.youtube.com/watch?v=nLO0WN9KwrQ";"2024-12-11T14:16:26+0000";"2024-12-19T19:31:01+0000";""
"1";"106";"4";"1783566445269444_992002336304808";"data";"data.*";"fetched (200)";"2025-04-22 07:21:45.853274";"Facebook:/<page-id>/posts";"🚩🗣️En el #díadelosderechoshumanos, recordamos que en 🇨🇴 Colombia el confinamiento vulnera de manera grave los DDHH de la población civil y, aunque se reconoce como un hecho victimizante desde 2016, en el marco de la Ley 1448 de Víctimas y Restitución de Tierras, todavía son desconocidas sus dimensiones reales y impacto en las comunidades permanece invisible. 💥";"2024-12-11T00:01:43+0000";"2024-12-19T19:30:43+0000";""
"1";"107";"4";"1783566445269444_991936886311353";"data";"data.*";"fetched (200)";"2025-04-22 07:21:45.853274";"Facebook:/<page-id>/posts";"Este 2024, celebramos el 40° aniversario de la Declaración de Cartagena, un hito de cooperación y compromiso en América Latina y el Caribe para proteger a las personas forzadas a huir.   https://www.acnur.org/cartagena40";"2024-12-10T21:32:43+0000";"2024-12-19T19:30:31+0000";""
"1";"108";"4";"1783566445269444_991810942990614";"data";"data.*";"fetched (200)";"2025-04-22 07:21:45.853274";"Facebook:/<page-id>/posts";"¡Nuevo nombre, misma misión! 💙 Somos Panas Colombia ahora se llama ACNUR Colombia.  Seguimos trabajando por quienes más lo necesitan.  Encuéntranos en facebook.com/acnurcolombia ¡Te esperamos!";"2024-12-10T16:58:17+0000";"2024-12-19T19:30:21+0000";""
"1";"109";"4";"1783566445269444_991713246333717";"data";"data.*";"fetched (200)";"2025-04-22 07:21:45.853274";"Facebook:/<page-id>/posts";"En Cartagena, líderesas y jóvenes dieron vida a sus historias con plastilina.  🎨 En el marco de la Exposición Refugiados y Migrantes en América, el artista @seloexplicoconplastilina lideró el taller “Mi vida en cuadritos”, una experiencia creativa donde cada participante utiliza la plastilina como herramienta para narrar sus vivencias.  🤝 Estos talleres se llevaron a cabo en colaboración con nuestros socios @fundacionrenacercolombia y @fcccolombia  🎟 Recuerda que la exposición está abierta en el @cfcecartagena en Cartagena todo el mes de diciembre. Visítala junto a tu familia, amigos y conocidos.";"2024-12-10T14:11:56+0000";"2024-12-19T19:39:01+0000";""
"1";"110";"4";"1783566445269444_988179253353783";"data";"data.*";"fetched (200)";"2025-04-22 07:21:45.853274";"Facebook:/<page-id>/posts";"🤝💙 Hoy celebramos el #DíaDelVoluntariado, con un homenaje a quienes dedican su tiempo y esfuerzo a hacer del mundo un lugar mejor.  ¡Gracias a todas y todos los que se unen a esta causa!  🙏💕 #DíaDelVoluntariado #ACNUR #JuntosPodemos";"2024-12-05T14:37:51+0000";"2024-12-19T19:39:18+0000";""
"1";"111";"4";"1783566445269444_987022053469503";"data";"data.*";"fetched (200)";"2025-04-22 07:21:45.853274";"Facebook:/<page-id>/posts";"👩‍🦽 Las personas con discapacidad enfrentan riesgos de violencia, exclusión y barreras para acceder a derechos y servicios esenciales. Desde ACNUR, promovemos la garantía de su protección, acceso a oportunidades, respeto e integración. 💪  Creemos en un futuro donde sus habilidades brillen y beneficien a sus familias y comunidades.  #ConLosRefugiados #InclusiónEsJusticia";"2024-12-03T23:53:55+0000";"2024-12-19T19:39:28+0000";""
"1";"112";"4";"1783566445269444_986236993548009";"data";"data.*";"fetched (200)";"2025-04-22 07:21:45.853274";"Facebook:/<page-id>/posts";"⭕👉🏽Estas cifras evidencian la urgente necesidad de fortalecer mecanismos de protección y garantías para las defensoras de derechos humanos en Colombia. 🙋🏽‍♀️  🍃✨Durante los #16Días de activismo, conmemoramos a quienes cuidan la vida en los territorios, contribuyen a la construcción de paz y la defensa de los derechos fundamentales, aún cuando esto pone en riesgo sus vidas.  📣Las defensoras de DDHH enfrentan riesgos diferenciales que no solo se derivan de su labor y liderazgo, sino de su género, etnia, estatus social y orientación sexual.  🗣️Ratificamos nuestro compromiso para avanzar en el fortalecimiento de:  ✅Respuesta con enfoque de género. ✅Medidas y políticas públicas efectivas. ✅Redes comunitarias y alianzas institucionales. ✅Participación de mujeres en la toma de decisiones.  #DiaDeLasDefensoras #Prodefensoras #DefendamosalasDefensoras #Nohayexcusa";"2024-12-02T20:27:28+0000";"2024-12-19T19:39:39+0000";""
"1";"113";"4";"1783566445269444_986093763562332";"data";"data.*";"fetched (200)";"2025-04-22 07:21:45.853274";"Facebook:/<page-id>/posts";"🎥✨ ""La plastilina transforma vidas"" – Edgar Álvarez Se lo explico con plastilina?   🌍 47 docentes de Bogotá participaron en talleres con Edgar Álvarez y su equipo Se lo Explico con Plastilina, sobre refugio y migración, moldeando empatía y derribando prejuicios.  👩‍🏫 Historias, arte y educación que abren camino a una sociedad más inclusiva.  📌 Descubre cómo el arte puede cambiar la perspectiva desde las aulas. ¡Mira el video completo ahora! 💙  #ForzadosAHuir  Secretaría de Educación de Bogotá";"2024-12-02T15:35:43+0000";"2024-12-19T19:39:50+0000";""
"1";"114";"4";"1783566445269444_981165877388454";"data";"data.*";"fetched (200)";"2025-04-22 07:21:45.853274";"Facebook:/<page-id>/posts";"Este #25N hacemos más visible que en comunidades indígenas y afrocolombianas, las mujeres enfrentan violencias que vulneran sus derechos a la libre movilidad, al acceso a alimentos y a servicios esenciales.  Hoy reconocemos su lucha y resiliencia en el Día Internacional de la Eliminación de la Violencia contra la Mujer. #Únete  Descubre historias de resistencia y esperanza en la exposición fotográfica Paraísos Confinados: 🔸 Medellín: Consultorio Jurídico, Universidad de Antioquia. 🔸 Manizales: Estación Los Cámbulos, Cable Aéreo. 🗓️ Abierta hasta el 19 de diciembre de 2024.  #25N #16DíasDeActivismo #ContraLaViolenciaDeGénero #ACNUR";"2024-11-25T22:49:20+0000";"2024-12-19T19:40:27+0000";""
"1";"115";"4";"1783566445269444_979016654270043";"data";"data.*";"fetched (200)";"2025-04-22 07:21:45.853274";"Facebook:/<page-id>/posts";"📍Bajo Calima, Buenaventura  Seguimos apoyando a 🙋🏾‍♀️🙋🏻‍♂️afrodescendientes e indígenas en su retorno. Donamos elementos de protección comunitaria como lámparas solares y mosquiteros, complemento a acciones del Estado colombiano para hacer sostenible su permanencia en el territorio.";"2024-11-22T21:29:26+0000";"2024-12-19T19:40:40+0000";""
"1";"116";"4";"1783566445269444_978136011024774";"data";"data.*";"fetched (200)";"2025-04-22 07:21:45.853274";"Facebook:/<page-id>/posts";"📌La Declaración de Cartagena es un compromiso colectivo y humanitario enfocado en la protección integral, así como la búsqueda y promoción de soluciones duraderas para refugiados y personas apátridas en América Latina y el Caribe 🌎🫂.  🗯️📜Su firma marcó un precedente jurídico en materia de derechos humanos, solidaridad, responsabilidad compartida y distribución de cargas entre los estados 🫱🏻‍🫲🏽.  🗣️La plena integración de personas refugiadas y en movimiento en las comunidades de acogida contrarresta 🙅🏽‍♀️ las narrativas negativas y la discriminación sistémica en los comportamientos de nuestra sociedad ✨🫂.";"2024-11-21T16:12:30+0000";"2024-12-19T19:40:53+0000";""
"1";"117";"4";"1783566445269444_976007524570956";"data";"data.*";"fetched (200)";"2025-04-22 07:21:45.853274";"Facebook:/<page-id>/posts";"Si estás en proceso en Movilidad Segura...  ❗Recuerda que los tiempos de respuesta pueden variar.  🤚🏻Espera instrucciones oficiales y no tomes decisiones apresuradas.  🚨Consulta fuentes confiables para evitar información falsa.";"2024-11-18T19:06:03+0000";"2025-01-03T16:13:12+0000";""
"1";"118";"4";"1783566445269444_974358661402509";"data";"data.*";"fetched (200)";"2025-04-22 07:21:45.853274";"Facebook:/<page-id>/posts";"🚩🗣️La xenofobia es el miedo y estigmatización hacia los extranjeros, que se manifietsa en tratos inadecuados hacia quienes lucen distinto, hablan otro idioma, tienen un acento diferente u otras costumbres 🙅🏽.  🙋🏽‍♀️✨Por ello, ACNUR reconoce la importancia de la empatía, respeto y solidaridad en nuestra sociedad, pues fortalecen el sentido comunitario y las relaciones sociales 🫱🏻‍🫲🏽🍃.";"2024-11-16T14:44:19+0000";"2024-11-16T14:44:19+0000";""
"1";"119";"4";"1783566445269444_973187011519674";"data";"data.*";"fetched (200)";"2025-04-22 07:21:45.853274";"Facebook:/<page-id>/posts";"ACNUR reconoce a todas las mujeres en Colombia por su humanidad, perseverancia, carácter, resistencia y fortaleza.  Por su rol y aporte en la construcción de la historia del país, consagrándose como lideresas, sobrevivientes y facilitadoras en los procesos del territorio.   Por los aportes significativos que hacen en el empoderamiento de sus comunidades y la promoción de la integración desde una perspectiva de género y equidad.";"2024-11-14T21:52:42+0000";"2024-11-14T21:52:42+0000";""
"1";"120";"4";"1783566445269444_962741599230882";"data";"data.*";"fetched (200)";"2025-04-22 07:21:45.853274";"Facebook:/<page-id>/posts";"🌿 Cuando la naturaleza habla, COCOMASUR escucha 🌍  En la compleja zona del Darién, este consejo comunitario brilla por los programas de protección, y conservación de su territorio, su cultura y su conocimiento.   🎥 ¡Te invitamos a ver este viaje extraordinario de resistencia, conservación y esperanza! 👉 https://youtu.be/KlQCt_dnQIU";"2024-10-31T20:20:32+0000";"2024-10-31T20:20:32+0000";""
"1";"121";"4";"1783566445269444_962604775911231";"data";"data.*";"fetched (200)";"2025-04-22 07:21:45.853274";"Facebook:/<page-id>/posts";"🌎 Tan solo en el 2023, 351,000 personas fueron desplazadas por desastres en Colombia.                          Únete a nuestro evento en la #COP16 para explorar el nexo entre cambio climático, pérdida de biodiversidad y desplazamiento forzado.  🎤 Participan:  Magistrada Natalia Ángel de la Corte Constitucional 🇨🇴 Erika Castro, @defensoriacol  Duvalier Sánchez, Representante a la Cámara @duvaliersanchez  Esneda Saavedra, Consejera de la @onic_colombia  Everildys Córdoba, Lideresa @cocomasur                        👩‍💼 Moderadora: Adriana Buchelli, oficial de protección, ACNUR Colombia  📅 1 de noviembre ⏰ 9:30 a.m. - 11:00 a.m. 🎥 En vivo por YouTube: @onucolombia   ¡No te lo pierdas!";"2024-10-31T16:18:26+0000";"2024-10-31T16:18:26+0000";""
"1";"122";"4";"1783566445269444_960389382799437";"data";"data.*";"fetched (200)";"2025-04-22 07:21:45.853274";"Facebook:/<page-id>/posts";"En bici 🚲, con familia 💙 y seres queridos 🐶 continuamos disfrutando del Festival de Cine Colombia Migrante durante la #COP16  A través de cuatro pantallas en diferentes lugares de la ciudad, personas refugiadas, migrantes, desplazadas, caleños/as y turistas han conocido diversas historias de resiliencia y lucha por la protección de la naturaleza y la vida.";"2024-10-28T16:59:08+0000";"2024-10-28T16:59:08+0000";""
"1";"123";"4";"1783566445269444_958092183029157";"data";"data.*";"fetched (200)";"2025-04-22 07:21:45.853274";"Facebook:/<page-id>/posts";"🌍 En la #COP16, nos complace anunciar que, junto IOM - UN Migration y UN Environment Programme, organizaremos el evento: ""Clima, paz, seguridad y movimientos mixtos"" este lunes 28 de octubre, 2 p.m 🇨🇴 | 📢En el Pabellón ONU y en vivo por YouTube @OnuColombia. ¡No te lo pierdas!";"2024-10-25T17:01:35+0000";"2024-10-25T17:01:35+0000";""
"1";"124";"4";"1783566445269444_957486353089740";"data";"data.*";"fetched (200)";"2025-04-22 07:21:45.853274";"Facebook:/<page-id>/posts";"Conoce más del artista colombiano Edgar Álvarez -@seloexplicoconplastilina- y su exposición Refugiados y Migrantes en América, que se despide de Cúcuta este sábado 26 de octubre.  Esta muestra es el resultado de una investigación y trabajo de campo de más de 10 años. Incluye figuras en plastilina, fotografías, animaciones y maquetas que representan historias de vida de personas refugiadas y migrantes, promoviendo una comprensión más profunda, más empática y más solidaria hacia estas poblaciones.  Aún puedes visitarla en el Centro Cultural Quinta Teresa.";"2024-10-24T22:51:42+0000";"2024-10-24T22:51:42+0000";""
"1";"125";"4";"1783566445269444_957310633107312";"data";"data.*";"fetched (200)";"2025-04-22 07:21:45.853274";"Facebook:/<page-id>/posts";"Desde la #COP16, celebramos este #DíaDeLaONU reafirmando nuestro compromiso con la protección de las personas, las comunidades y los territorios donde habitan. 🌍💙  ¡Seguiremos buscando soluciones para que las personas forzadas a huir puedan reconstruir sus proyectos de vida!";"2024-10-24T17:34:12+0000";"2024-10-24T17:34:12+0000";""
"1";"126";"4";"1783566445269444_957282069776835";"data";"data.*";"fetched (200)";"2025-04-22 07:21:45.853274";"Facebook:/<page-id>/posts";"Hoy proyectaremos la película La Ilusión de la abundancia. 💙 Te invitamos a disfrutarla y conversar con  su directora, Érika González, y sus protagonistas: Bertha Cáceres (Honduras), Máxima Acuña (Perú) y Carolina de Moura (Brasil).  Recuerda que también la puedes ver por streaming a través de YouTube @onucolombia   #CineParaLaVida";"2024-10-24T16:42:43+0000";"2024-10-24T16:42:43+0000";""
"1";"127";"4";"1783566445269444_956485296523179";"data";"data.*";"fetched (200)";"2025-04-22 07:21:45.853274";"Facebook:/<page-id>/posts";"No te lo pierdas! Hoy, 23 de octubre, a las 5:30 p.m., acompáñanos en nuestro Live desde la #COP16 💙  Hablaremos sobre las actividades de ACNUR en esta COP16 Colombia, en la que estaremos explorando el vínculo cada día más evidente entre el cambio climático, la pérdida de biodiversidad y el desplazamiento forzado. 🌍 ¡Únete a la conversación!";"2024-10-23T15:30:58+0000";"2024-10-23T15:32:53+0000";""
"1";"128";"4";"1783566445269444_955878523250523";"data";"data.*";"fetched (200)";"2025-04-22 07:21:45.853274";"Facebook:/<page-id>/posts";"Mujeres como Aida y María Alejandra están liderando el cambio en sus comunidades del Caribe colombiano, creando espacios seguros y empoderando a otras mujeres. Su valentía y compromiso son un ejemplo de cómo el liderazgo transforma vidas. 🙌💜  Agradecemos a la Lotería del Código Postal de Suecia @postkodlotteriet por sus contribuciones que nos permiten trabajar el empoderamiento de mujeres y niñas.  #ConLosRefugiados #Desplazados #EmpoderamientoFemenino #Liderazgo #VBG";"2024-10-22T20:00:15+0000";"2024-10-22T20:00:15+0000";""
"1";"129";"4";"1783566445269444_952943020210740";"data";"data.*";"fetched (200)";"2025-04-22 07:21:45.853274";"Facebook:/<page-id>/posts";"🌿✨ Mujeres valientes en la vereda Las Varas, Nariño, están transformando su futuro con ingenio, resiliencia y trabajo. En un espacio seguro, se reúnen para compartir experiencias, conocer sus derechos y brindar apoyo a quienes sufren violencia en sus hogares y en la comunidad. 💪🌾  Gracias al apoyo del Fondo Central para la Acción en Casos de Emergencia (CERF), ACNUR y sus socios han brindado protección y asistencia vital a 13,642 personas afectadas por emergencias derivadas del conflicto armado en Colombia, desde junio de 2023 hasta septiembre de 2024. 🙌💚";"2024-10-18T23:27:41+0000";"2024-10-18T23:27:41+0000";""
"1";"130";"4";"1783566445269444_952925543545821";"data";"data.*";"fetched (200)";"2025-04-22 07:21:45.853274";"Facebook:/<page-id>/posts";"🌿✨ Mujeres valientes en la vereda Las Varas, Nariño, están transformando su futuro con ingenio, resiliencia y trabajo. En un espacio seguro, se reúnen para compartir experiencias, conocer sus derechos y brindar apoyo a quienes sufren violencia en sus hogares y en la comunidad. 💪🌾  Gracias al apoyo del Fondo Central para la Acción en Casos de Emergencia (CERF), ACNUR y sus socios han brindado protección y asistencia vital a 13,642 personas afectadas por emergencias derivadas del conflicto armado en Colombia, desde junio de 2023 hasta septiembre de 2024. 🙌💚";"2024-10-18T22:50:04+0000";"2024-10-18T22:50:04+0000";""
"1";"131";"4";"1783566445269444_952866553551720";"data";"data.*";"fetched (200)";"2025-04-22 07:21:45.853274";"Facebook:/<page-id>/posts";"¡Prográmate para acompañarnos en la #COP16! 🌍  ACNUR promoverá la protección de las comunidades y sus territorios, frente al desplazamiento forzado causado por efectos del cambio climático y pérdida de biodiversidad. 💙🌿";"2024-10-18T20:33:46+0000";"2024-10-18T20:33:46+0000";""
"1";"132";"4";"acnurcolombia";"offcut";"";"fetched (200)";"2025-04-22 07:21:45.853274";"Facebook:/<page-id>/posts";"";"";"";""
"1";"133";"5";"166900206660207_1038562544976013";"data";"data.*";"fetched (200)";"2025-04-22 07:21:46.818296";"Facebook:/<page-id>/posts";"Lideramos en la provincia de📍 García Rovira una sesión informativa en el marco del Programa de Estabilización Comunitaria de USAID Colombia   Durante el evento, apoyamos técnicamente a gobiernos locales y socios estratégicos en temas de gestión migratoria y presentamos el portafolio de la Organización 🇨🇴 🇻🇪🤝.  En el evento resaltamos la importancia de regularizar a niñas, niños y adolescentes venezolanos en instituciones educativas y se reconoció la necesidad de trabajar juntos para enfrentar los desafíos en la gestión migratoria y mejorar la comunicación entre las entidades, creando así oportunidades para optimizar la atención en la región. De esta manera, contribuimos a una gestión ordenada, regular y digna.  #GIFMMContigo";"2024-12-30T19:20:04+0000";"2024-12-30T19:20:04+0000";""
"1";"134";"5";"166900206660207_1038401441658790";"data";"data.*";"fetched (200)";"2025-04-22 07:21:46.818296";"Facebook:/<page-id>/posts";"📸✨ ¡Cerramos con éxito un importante capítulo!  🎓 En Bogotá, 40 personas participantes de la iniciativa Guardianes, liderada por Sevicol,  recibieron su certificación como Guardas de Seguridad, tras completar dos meses de formación profesional.  💼 Este logro es parte del proyecto Salvar vidas, crear resiliencia y soluciones duraderas, financiado por la 🇰🇷  Embajada de Corea en Colombia e implementado por la OIM.   🌟 Con estas acciones, seguimos avanzando en la reducción de las brechas de empleabilidad que enfrentan migrantes, colombianos retornados y comunidades de acogida.";"2024-12-30T14:32:06+0000";"2024-12-31T02:10:21+0000";""
"1";"135";"5";"166900206660207_1036402761858658";"data";"data.*";"fetched (200)";"2025-04-22 07:21:46.818296";"Facebook:/<page-id>/posts";"Toluviejo, en Sucre, puede ser tu lugar ideal para estas vacaciones de fin de año 🥳😎☀️. Disfruta del sol, los senderos ecológicos, sus fuentes hídricas y la comida típica de la región 🤤.  Viaja y vive momentos inolvidables junto a Ecorutas Montes de Maria   Junto a USAID Colombia  y Travolution.org  fortalecimos a Ecorutas a nivel organizativo y consolidamos una oferta de turismo comunitario sostenible y competitivo en los Montes de María.   #HilandoComunidades";"2024-12-28T00:00:04+0000";"2024-12-28T00:00:04+0000";""
"1";"136";"5";"166900206660207_1036154591883475";"data";"data.*";"fetched (200)";"2025-04-22 07:21:46.818296";"Facebook:/<page-id>/posts";"Grandes preguntas + Computadores e internet = Conexión y oportunidades para tod@s 🫶🏽🙋🏽‍♂️  Junto a USAID Colombia y SOLE Colombia finalizamos el tercer año de nuestro proyecto enfocado en cerrar la brecha digital en comunidades rurales de Colombia.   Resultados destacados:  ✅ Más de 40 embajadores capacitados en 9 comunidades rurales de Antioquia, Valle, Cauca y Montes de María. 💻 27 equipos entregados y 9 soluciones tecnológicas instaladas, creando espacios con conexión a internet. 📚 Más de 50 encuentros realizados, fortaleciendo habilidades para la vida y competencias tecnológicas.  Este proyecto impulsa el desarrollo tecnológico y personal, brindando a sobrevivientes del conflicto y comunidades afectadas por la violencia herramientas para una vida productiva y en paz. 💚 #HilandoComunidades";"2024-12-27T15:00:25+0000";"2024-12-27T15:00:25+0000";""
"1";"137";"5";"166900206660207_1035689831929951";"data";"data.*";"fetched (200)";"2025-04-22 07:21:46.818296";"Facebook:/<page-id>/posts";"En #Cali, durante el evento de cierre de la estrategia PRO Comunitario y en el marco de la conmemoración del #DíaDelMigrante #EntreLazos, se entregaron constancias de participación a 36 lideresas y líderes 👥 de las organizaciones de base comunitaria de la Fundación Alianzas Solidarias y la Corporación Las Violetas. Estas personas culminaron con éxito el proceso de transferencia de conocimientos y metodologías impartido por la OIM y la Subsecretaría de Equidad de Género. ✨  El PRO Comunitario busca establecer un puente entre las instituciones y la comunidad, para salvaguardar los derechos de las personas y fortalecer las capacidades locales. 🤝   Esta actividad se realizó en colaboración con @BienestarSocialCali y la @AlcaldiaDeCali, y durante la actividad se contó con la participación del Semillero Orquestal Binacional SIN FRONTERAS.   📍 Esta iniciativa es posible gracias al apoyo financiero de U.S. Department of State:  Bureau of Population, Refugees, and Migration";"2024-12-27T00:00:09+0000";"2024-12-27T00:00:09+0000";""
"1";"138";"5";"166900206660207_1035611071937827";"data";"data.*";"fetched (200)";"2025-04-22 07:21:46.818296";"Facebook:/<page-id>/posts";"#TBT | Recordemos juntos la conmemoración del #DiaInternacionalDeLaMujerRural, el pasado 25 de octubre, en dónde a través del arte, el teatro, una muestra empresarial y una exposición campesina de mujeres rurales sostenibles, celebramos este día en la vereda Todos los Santos en #Arauca. 🌸  Con la colaboración de organizaciones humanitarias e instituciones gubernamentales destacamos el esfuerzo, dedicación, resiliencia y el gran aporte de la mujer en la economía, la seguridad alimentaria y la sostenibilidad ambiental de los territorios. 🌾✨  Esta iniciativa fue posible gracias al apoyo de Aecid Colombia";"2024-12-26T20:53:58+0000";"2024-12-26T20:53:58+0000";""
