"level";"id";"parent_id";"object_id";"object_type";"object_key";"query_status";"query_time";"query_type";"message";"created_time";"updated_time";"error.message"
"1";"139";"5";"166900206660207_1035379875294280";"data";"data.*";"fetched (200)";"2025-04-22 07:21:46.818296";"Facebook:/<page-id>/posts";"🌊 San Antero en cada bocado🍽️  En Frescomar, la tradición y el sabor se unen en cada plato. Este emprendimiento, nacido en las playas de San Antero, tiene una misión clara: llevar lo mejor de la comida típica de la región a nuevos paladares y hacer que cada visitante descubra la esencia de su tierra. 🌴✨  A través del proyecto Protegiendo Sueños, apoyamos a estos jóvenes emprendedores a convertir su pasión por la cocina en un puente hacia el desarrollo local. 💙  Esta propuesta hace parte de la estrategia de relacionamiento de OIM con entidades del sector privado para el fomento de espacios que promuevan la construcción de paz. En compañía con Ocensa en Línea  buscamos generar caminos de esperanza para la niñez, la adolescencia y la juventud de Colombia.";"2024-12-26T13:30:47+0000";"2024-12-26T13:30:47+0000";""
"1";"140";"5";"166900206660207_1033996155432652";"data";"data.*";"fetched (200)";"2025-04-22 07:21:46.818296";"Facebook:/<page-id>/posts";"Les deseamos un 2025 lleno de prosperidad y logros. Sigamos trabajando juntos para que la #migración continúe siendo un motor de desarrollo en #Colombia 🇨🇴. Gracias por su apoyo y colaboración durante 2024.";"2024-12-24T14:37:28+0000";"2024-12-31T15:12:44+0000";""
"1";"141";"5";"166900206660207_1033954268770174";"data";"data.*";"fetched (200)";"2025-04-22 07:21:46.818296";"Facebook:/<page-id>/posts";"💅¡Belleza y estilo en Coveñas!✂️  StudioStyle es mucho más que un salón de belleza; es un espacio donde la creatividad y el talento transforman cada visita en una experiencia única. Trenzas, cortes, uñas y más, con el sello de calidad de jóvenes soñadores que trabajan por su comunidad. 🌟  Desde el proyecto Protegiendo Sueños, apoyamos sus metas, demostrando que la constancia y entrega son necesarias para construir un mejor futuro.  Esta propuesta hace parte de la estrategia de relacionamiento de OIM con entidades del sector privado para el fomento de espacios que promuevan la construcción de paz. En compañía con Ocensa en Línea  buscamos generar caminos de esperanza para la niñez, la adolescencia y la juventud de Colombia.";"2024-12-24T13:30:47+0000";"2024-12-24T13:30:47+0000";""
"1";"142";"5";"166900206660207_1033550162143918";"data";"data.*";"fetched (200)";"2025-04-22 07:21:46.818296";"Facebook:/<page-id>/posts";"Con el apoyo U.S. Department of State:  Bureau of Population, Refugees, and Migration | Embajada de los Estados Unidos Colombia, este año continuamos con los cursos de ‘preparación para la maternidad y la paternidad’ en 11 departamentos del país. Más de 6️⃣0️⃣0️⃣ mujeres y hombres de 🇻🇪 y 🇨🇴 han participado para fortalecer sus conocimientos en cuidados de la madre y recién nacido, lactancia materna, estimulación prenatal y más🤰🏽🤱🏽💙.  En estos cursos, también fortalecen sus conocimientos en derechos sexuales y reproductivos, planificación familiar y la prevención de las violencias basadas en género. Además, en coordinación con hospitales locales, las mujeres gestantes sin afiliación al Sistema de Salud en Colombia acceden a controles prenatales integrales y de calidad🤱🏽💙  #SaludparaTodos #MigraciónySalud🌎💙";"2024-12-23T23:00:07+0000";"2024-12-23T23:00:07+0000";""
"1";"143";"5";"166900206660207_1033472778818323";"data";"data.*";"fetched (200)";"2025-04-22 07:21:46.818296";"Facebook:/<page-id>/posts";"Llevamos a cabo  #AfíliatePorTuSalud en Arauca, Cesar, Cundinamarca, La Guajira, Magdalena, Norte de Santander, Santander, Valle del Cauca, Bolívar, Nariño, Antioquia, Atlántico y Bogotá 📍    Por medio de esta estrategia, se ha realizado la gestión para que más de 3️⃣0️⃣0️⃣0️⃣ nacionales venezolanos y colombianos retornados accedan a la ruta de afiliación al Sistema de Salud, que garantiza su acceso a servicios integrales como consultas, exámenes, medicamentos, intervenciones quirúrgicas, entre otros.  ✔️Conoce las claves para afiliarte y acceder a los servicios en salud en Colombia➡️ https://colombia.iom.int/es/afiliacion-en-salud  #AfíliatePorTuSalud es posible gracias al apoyo financiero de U.S. Department of State:  Bureau of Population, Refugees, and Migration | Embajada de los Estados Unidos Colombia   #SaludParaTodos  #MigraciónySalud🌍💙";"2024-12-23T20:00:16+0000";"2024-12-23T20:00:16+0000";""
"1";"144";"5";"166900206660207_1033256518839949";"data";"data.*";"fetched (200)";"2025-04-22 07:21:46.818296";"Facebook:/<page-id>/posts";"🍹🌴 ¡Sabores frescos de Córdoba!  Desde Pueblo Nuevo llega Jugo Cordobés, un emprendimiento que celebra las frutas típicas de la región, transformándolas en bebidas deliciosas y llenas de vida. Cada sorbo es una invitación a descubrir los sabores de su tierra. 🥭🍓  Con el proyecto Protegiendo Sueños, impulsamos iniciativas como esta, que llenan de orgullo y sabor nuestras comunidades y brindan nuevos proyectos de vida a jóvenes del territorio.  Esta propuesta hace parte de la estrategia de relacionamiento de OIM con entidades del sector privado para el fomento de espacios que promuevan la construcción de paz. En compañía con Ocensa en Línea  buscamos generar caminos de esperanza para la niñez, la adolescencia y la juventud de Colombia.";"2024-12-23T13:31:15+0000";"2024-12-23T13:31:15+0000";""
"1";"145";"5";"166900206660207_1033028318862769";"data";"data.*";"fetched (200)";"2025-04-22 07:21:46.818296";"Facebook:/<page-id>/posts";"¡Así se vivió el cierre de Protegiendo Sueños! En dos jornadas llenas de emoción en Coveñas y Pueblo Nuevo, celebramos junto a niños, niñas, adolescentes y jóvenes participantes, familias, aliados y actores comprometidos, los logros alcanzados en esta tercera fase del proyecto. 💡 481 niños, niñas, adolescentes y jóvenes participaron en procesos de formación enfocados en su empoderamiento para prevenir vulneraciones de derechos. Además, destacamos el desarrollo de cuatro increíbles iniciativas comunitarias productivas que están transformando sus territorios:   🍴 Frescomar: una cocina oculta en San Antero que fusiona tradición y creatividad para destacar los sabores típicos de la región.   💇‍♀️ Studio Style: un innovador salón de belleza en Coveñas, donde el cuidado personal se convierte en una herramienta de empoderamiento.   🍹 Jugo Cordobés: un emprendimiento en Pueblo Nuevo que deleita con bebidas naturales hechas a base de frutas locales.   👗 BlackShop: una tienda virtual que combina diseño juvenil con comercio digital, impulsando el talento creativo de la región. Sabemos que este es solo el comienzo de muchas historias de éxito en Córdoba y Sucre. ¡Sigamos soñando juntos! ✨   La iniciativa Protegiendo Sueños hace parte de la estrategia de relacionamiento de la OIM con el sector privado, como Ocensa en Línea, para fomentar espacios que promuevan la construcción de paz y generar caminos de esperanza para la niñez, la adolescencia y la juventud de Colombia.";"2024-12-23T06:38:47+0000";"2024-12-23T06:38:47+0000";""
"1";"146";"5";"166900206660207_1031320132366921";"data";"data.*";"fetched (200)";"2025-04-22 07:21:46.818296";"Facebook:/<page-id>/posts";"En estos días recibimos la visita de la Directora de la División de Migración y Salud en Ginebra de #OIM, Poonam Dhavan, quien participó de la 'V Escuela Mundial de Salud de Refugiados y Migrantes’, un evento organizado por World Health Organization (WHO). Durante su presencia en el país compartimos logros, resultados, lecciones aprendidas y mejores prácticas en #MigraciónYSalud que venimos implementando.";"2024-12-20T23:00:42+0000";"2024-12-20T23:00:42+0000";""
"1";"147";"5";"166900206660207_1031283769037224";"data";"data.*";"fetched (200)";"2025-04-22 07:21:46.818296";"Facebook:/<page-id>/posts";"En Colombia, la migración no solo significa cruzar fronteras; es la oportunidad de entrelazar culturas, historias y sueños. En todo el país, en el marco del Día del Migrante la campaña Entre-lazos: derechos y diversidad para construir comunidad, ha conectado vidas a través de talleres culturales y diálogos comunitarios.   Hemos realizado eventos institucionales y muestras culturales a nivel nacional, en más de 12 ciudades entre ellas Ipiales, Buenaventura, Cartagena, Ibagué, y Quibdó. Cada actividad es un paso hacia un futuro compartido, donde personas migrantes, desplazadas, víctimas y comunidades de acogida trabajan juntos por una sociedad más fuerte y solidaria.   Este 18 de diciembre, #DíaDelMigrante, en Bogotá también llevamos a cabo varias acciones con las que reafirmamos nuestro compromiso con la defensa de los derechos de estas poblaciones. Seguiremos trabajando por su bienestar y dignidad, garantizando la gestión de una migración ordenada y segura que beneficia a todos. #CadaPaso #EntreLazos #IMD2024";"2024-12-20T21:32:43+0000";"2024-12-20T21:32:43+0000";""
"1";"148";"5";"166900206660207_1030602555772012";"data";"data.*";"fetched (200)";"2025-04-22 07:21:46.818296";"Facebook:/<page-id>/posts";"Desde el municipio de #VilladelRosario y su icónico Museo Casa Natal del General Santander, presentamos nuestra campaña #Entrelazos, en el marco de la conmemoración del #DíaDelMigrante. Una jornada que remarcó la importancia de los derechos humanos, la migración ordenada y el cuidado del medio ambiente, a través de la elaboración de un mural comunitario, donde la comunidad migrante, retornada y de acogida intercambiaron lazos de amistad y experiencias de integración. Esta iniciativa contó con la coordinación de la @Gobernación de Norte de Santander y el apoyo de la Fundación MOIRAS y La Fundación El Pilar #GIFMMContigo.";"2024-12-20T00:15:39+0000";"2024-12-20T18:13:40+0000";""
"1";"149";"5";"166900206660207_1030547735777494";"data";"data.*";"fetched (200)";"2025-04-22 07:21:46.818296";"Facebook:/<page-id>/posts";"📍 Cartagena del Chairá tiene una nueva historia que contar.  Conoce la Ruta de la Memoria de este municipio en el corazón de Caquetá, un recorrido por lugares que conservan las huellas del pasado y muestran los pasos hacia la reconciliación. 🌱  Esta iniciativa, liderada por las comunidades, la Mesa de Víctimas, Cinep Programa Por la Paz, y el proyecto #SosteniendoLaPaz, destaca el legado de resistencia y esperanza que define a Cartagena del Chairá.  Financiada por KOICA COLOMBIA OFFICE, implementada por OIM, y desarrollada en articulación con Renovación del Territorio, esta ruta es un símbolo de transformación y memoria.  🔗 Descubre más sobre esta inspiradora iniciativa aquí: 👉https://colombia.iom.int/es/news/sosteniendo-la-paz-lanza-ruta-de-la-memoria-en-cartagena-del-chaira   👉 Conoce la ruta Digital: https://cinep.org.co/rutadelamemoriacartagenadelchaira/  #EchandoRaicesParaElFuturo";"2024-12-19T22:06:45+0000";"2024-12-19T22:06:45+0000";""
"1";"150";"5";"166900206660207_1030538652445069";"data";"data.*";"fetched (200)";"2025-04-22 07:21:46.818296";"Facebook:/<page-id>/posts";"";"2024-12-19T21:48:33+0000";"2024-12-19T21:48:33+0000";""
"1";"151";"5";"166900206660207_1030464319119169";"data";"data.*";"fetched (200)";"2025-04-22 07:21:46.818296";"Facebook:/<page-id>/posts";"¡Acompáñanos hoy a las 2:00 p.m. en la firma de nuestra Estrategia País!  Este instrumento orienta nuestra trabajo en el país para los próximos 4 años.   Cancillería Colombia ONU Colombia";"2024-12-19T19:29:12+0000";"2024-12-19T19:30:18+0000";""
"1";"152";"5";"166900206660207_1030397162459218";"data";"data.*";"fetched (200)";"2025-04-22 07:21:46.818296";"Facebook:/<page-id>/posts";"#TBT En el marco del Día Internacional del Migrante, recordamos la importancia de garantizar los derechos de las personas migrantes, especialmente de niñas, niños y adolescentes, para construir un futuro con bienestar y oportunidades.  En Apartadó, Antioquia, se llevó a cabo una jornada que benefició a 146 menores, gracias al Programa de Estabilización Comunitaria de USAID Colombia, la OIM y aliados como la Defensoría del Pueblo de Colombia y el GIFMM Local. Se ofrecieron servicios clave como regularización, acceso a salud, apoyo psicosocial y espacios amigables para la niñez.  💙 Este tipo de iniciativas transforman vidas, acercan derechos esenciales y promueven una migración digna, regular y ordenada.  👉 Estas actividades son posibles gracias al apoyo del USAID Colombia.";"2024-12-19T17:11:01+0000";"2024-12-19T17:11:01+0000";""
"1";"153";"5";"166900206660207_1030286572470277";"data";"data.*";"fetched (200)";"2025-04-22 07:21:46.818296";"Facebook:/<page-id>/posts";"Las personas migrantes contribuyen a la innovación, las artes, las ciencias, la creación de empresas, el crecimiento empresarial y más.  En el #DíaDelMigrante y siempre, debemos reconocer y promover las oportunidades de la migración. #CadaPaso #EntreLazos";"2024-12-19T14:04:51+0000";"2024-12-19T14:04:51+0000";""
"1";"154";"5";"166900206660207_1029723019193299";"data";"data.*";"fetched (200)";"2025-04-22 07:21:46.818296";"Facebook:/<page-id>/posts";"Celebramos el Día de los DDHH y el #DíaDelMigrante con Entre-Lazos, USAID Colombia y Festival Internacional de Cine por los Derechos Humanos Colombia, llevando cine a 13 comunidades afectadas por el conflicto.  Las proyecciones visibilizaron la importancia de la unión y la diversidad para construir. 💙👉🏽  #HilandoComunidades";"2024-12-18T19:33:51+0000";"2024-12-19T08:14:58+0000";""
"1";"155";"5";"166900206660207_1029715855860682";"data";"data.*";"fetched (200)";"2025-04-22 07:21:46.818296";"Facebook:/<page-id>/posts";"Hoy conmemoramos el Día Internacional del Migrante y entre-memorias, escribimos la nuestra. #CadaPaso  Recuerda que cada historia compartida es una nueva página escrita en nuestra historia común de respeto y derechos.  #EntreLazos #IMD2024 #DDHH";"2024-12-18T19:19:24+0000";"2024-12-18T19:19:24+0000";""
"1";"156";"5";"166900206660207_1029622349203366";"data";"data.*";"fetched (200)";"2025-04-22 07:21:46.818296";"Facebook:/<page-id>/posts";"Hoy #DíaDelMigrante reafirmamos nuestro compromiso de promover una migración segura, ordenada y digna, trabajando tanto en beneficio de quienes se movilizan como de las comunidades de origen y destino. A través de esta labor, buscamos redefinir positivamente el impacto de la migración en las dinámicas sociales, económicas y culturales del país.  Hemos lanzado la campaña ‘#EntreLazos: con derechos y diversidad construimos comunidad”, un llamado a la integración, la empatía y el respeto por los derechos humanos de la población migrante, desplazada y sus comunidades de acogida, con actividades culturales en varias partes del país. Destacamos el compromiso de la sociedad y las instituciones en la protección de sus derechos y en la promoción de la inclusión.   #CadaPaso #IMD2024";"2024-12-18T16:27:51+0000";"2024-12-18T16:27:51+0000";""
"1";"157";"5";"166900206660207_1029614969204104";"data";"data.*";"fetched (200)";"2025-04-22 07:21:46.818296";"Facebook:/<page-id>/posts";"En 2025, será clave seguir el trabajo conjunto con Estados miembro, donantes, sector privado, sociedad civil y comunidades para aprovechar el poder transformador de la migración. #IMD2024   Conozca más sobre el Llamamiento Mundial 2025: https://www.iom.int/msite/global-appeal-2025/ #IOMGlobalAppeal";"2024-12-18T16:14:09+0000";"2024-12-18T16:14:09+0000";""
"1";"158";"5";"166900206660207_1029500779215523";"data";"data.*";"fetched (200)";"2025-04-22 07:21:46.818296";"Facebook:/<page-id>/posts";"Hoy es el Día Internacional del Migrante.  Los migrantes aportan mucho a las comunidades de todo el mundo: impulsan la innovación, fomentan la economía y apoyan a las familias en sus países de origen.  En 2025, #IOMGlobalAppeal tratará de aprovechar el poder de la migración garantizando el apoyo en #CadaPaso para los que se desplazan y las comunidades que dejan, así como a las que se unen.  Celebremos la resiliencia y el potencial transformador de la migración para construir un futuro mejor para todos.";"2024-12-18T13:01:10+0000";"2024-12-18T13:01:10+0000";""
"1";"159";"5";"166900206660207_1028176332681301";"data";"data.*";"fetched (200)";"2025-04-22 07:21:46.818296";"Facebook:/<page-id>/posts";"🌟 ¡Tolima fortalece su camino hacia la paz! 🌟  330 líderes y lideresas comunitarios culminaron su formación en Habilidades Relacionales para la Paz, adquiriendo herramientas para resolver conflictos y fortalecer la convivencia en sus comunidades. 🕊️  📍 Este proceso llegó a zonas rurales del sur de Tolima gracias a la colaboración con nuestro socio Cinep Programa Por la Paz, en el marco del proyecto #SosteniendoLaPaz, financiado por KOICA COLOMBIA OFFICE, implementado por OIM en articulación de Renovación del Territorio y el apoyo de policiaunipep.  👥 ¡Conoce cómo esta iniciativa está transformando comunidades! 🔗 Lee más aquí: https://bit.ly/3DkwUb6";"2024-12-16T15:35:57+0000";"2024-12-16T15:35:57+0000";""
"1";"160";"5";"166900206660207_1028130549352546";"data";"data.*";"fetched (200)";"2025-04-22 07:21:46.818296";"Facebook:/<page-id>/posts";"Hasta el 17 de diciembre podrás asistir a Expoartesanías y conocer a organizaciones de artesan@s de Montes de María, que con su arte aportan a la construcción de paz y al desarrollo de esta hermosa región. 💚 #HilandoComunidades";"2024-12-16T14:31:01+0000";"2024-12-16T14:31:01+0000";""
"1";"161";"5";"166900206660207_1028122609353340";"data";"data.*";"fetched (200)";"2025-04-22 07:21:46.818296";"Facebook:/<page-id>/posts";"En cada vínculo de culturas, construimos una sociedad que cuida, respeta y brinda esperanza.  #EntreLazos #CadaPaso #DíaDelMigrante #TejiendoComunidad #DDHH";"2024-12-16T14:19:49+0000";"2024-12-16T14:19:49+0000";""
"1";"162";"5";"166900206660207_1026727269492874";"data";"data.*";"fetched (200)";"2025-04-22 07:21:46.818296";"Facebook:/<page-id>/posts";"📢 ¡Si duele, NO es amor!   Durante estos #16Días de Activismo contra la violencia hacia las mujeres, junto a USAID Colombia, llevamos la campaña Si duele no es amor a varios municipios del país: Colosó y Toluviejo (Sucre), San Jacinto (Bolívar), Piendamó (Cauca) y Buenaventura (Valle del Cauca).  💡 ¿Qué hicimos? ✅ Compartimos información clave para identificar los diferentes tipos de violencia. ✅ Socializamos las rutas de atención disponibles en cada territorio. ✅ Distribuimos afiches en puntos estratégicos de las comunidades. ✅ Realizamos talleres de sensibilización y diálogo sobre el Violentómetro, una herramienta para reconocer señales de alerta.  💪 Porque juntas y juntos podemos construir comunidades libres de violencia. #HilandoComunidades #25N";"2024-12-14T16:44:43+0000";"2024-12-14T16:44:43+0000";""
"1";"163";"5";"OIMColombia";"offcut";"";"fetched (200)";"2025-04-22 07:21:46.818296";"Facebook:/<page-id>/posts";"";"";"";""
"1";"164";"6";"45235597147_1023989869761649";"data";"data.*";"fetched (200)";"2025-04-22 07:21:48.068609";"Facebook:/<page-id>/posts";"¿Sabías que entre los 3 y los 5 años los niños y niñas necesitan interacciones positivas con sus pares y agentes educativos para su desarrollo y aprendizaje? Este es el momento más importante de su educación: ¡la escuela los espera! Te contamos cómo hacer el proceso de matrícula gratuito aquí: 👉 https://s.mtrbio.com/fffezeoctv Ministerio de Educación Nacional de Colombia";"2024-12-30T18:02:03+0000";"2024-12-30T18:02:03+0000";""
"1";"165";"6";"45235597147_1023437556483547";"data";"data.*";"fetched (200)";"2025-04-22 07:21:48.068609";"Facebook:/<page-id>/posts";"En la zona rural del Catatumbo, Norte de Santander, trabajamos junto a la comunidad de Sakacdú para construir baterías sanitarias y baños que transforman vidas.  💧 Gracias a este esfuerzo, niños, niñas, adolescentes y sus familias ahora cuentan con acceso a un saneamiento digno, reduciendo enfermedades y promoviendo su bienestar.  💙 Continuamos comprometidos con la protección de la niñez y el cumplimiento de sus derechos. #UNICEFColombia";"2024-12-29T23:02:04+0000";"2024-12-29T23:02:04+0000";""
"1";"166";"6";"45235597147_1022499293244040";"data";"data.*";"fetched (200)";"2025-04-22 07:21:48.068609";"Facebook:/<page-id>/posts";"¡Dile NO a la violencia contra la niñez!   La disciplina nunca justifica el maltrato. Es momento de proteger, respetar y educar desde el amor.   💙 Únete a nuestra campaña #TrátameAlDerecho. Juntos podemos construir un mundo donde ninguna forma de violencia contra niños, niñas y adolescentes sea justificada.   🔗 Haz clic aquí para conocer más: https://s.mtrbio.com/frinhacybb";"2024-12-28T14:02:06+0000";"2024-12-28T14:02:06+0000";""
"1";"167";"6";"45235597147_1021806096646693";"data";"data.*";"fetched (200)";"2025-04-22 07:21:48.068609";"Facebook:/<page-id>/posts";"El deporte es disciplina y diversión, pero también un espacio seguro para niños y niñas. Esto nos cuenta Esther, que con su iniciativa de #ImpulsoJuvenil lidera una escuela deportiva en Tibú (Norte de Santander) y sueña con que sus estudiantes puedan llegar a los Olímpicos.   Este proyecto, junto a UNODC Región Andina y Cono Sur y #FAO busca aumentar la participación e incidencia de las y los jóvenes en la protección de sus derechos, así como promover agendas juveniles en los planes de desarrollo a nivel local, departamental y nacional para contribuir a la construcción de una paz sostenible y duradera, en asocio con 5ta con 5ta crew  y el apoyo de United Nations Peacebuilding y el Fondo Multidonante de las Naciones Unidas para la Paz";"2024-12-27T14:03:11+0000";"2024-12-27T14:03:11+0000";""
"1";"168";"6";"45235597147_1021115460049090";"data";"data.*";"fetched (200)";"2025-04-22 07:21:48.068609";"Facebook:/<page-id>/posts";"Hanna, una niña de Quibdó (Chocó), demostró que las niñas tienen el poder de transformar el mundo.💡🤖  Con mucha creatividad y trabajo en equipo, Hanna y sus amigas diseñaron un prototipo robótico para apoyar a los adultos mayores de su comunidad, comprobando que la tecnología también puede ser una herramienta de solidaridad y cambio.   🌎❤️ Conoce su historia completa en nuestro canal de YouTube 🌟 #ElPoderDeLasNiñas #NiñasConMetas";"2024-12-26T15:53:18+0000";"2024-12-27T11:48:18+0000";""
"1";"169";"6";"45235597147_1019706056856697";"data";"data.*";"fetched (200)";"2025-04-22 07:21:48.068609";"Facebook:/<page-id>/posts";"Nuestro deseo en estas fechas y siempre: que cada niña, niño y adolescente, sin importar su condición o el lugar donde se encuentre, tenga todos sus derechos garantizados.   Seguiremos trabajando en 2025 para que cada infancia tenga derechos, oportunidades y esperanza.   ¡Felices fiestas! ✨🎊";"2024-12-24T15:27:45+0000";"2024-12-27T11:48:27+0000";""
"1";"170";"6";"45235597147_1019033566923946";"data";"data.*";"fetched (200)";"2025-04-22 07:21:48.068609";"Facebook:/<page-id>/posts";"Si te has retirado de la escuela, #AúnEstásATiempo de volver, tu futuro te espera. Busca la institución más cercana a tu hogar y matricúlate totalmente gratis. ¡Nunca es tarde para volver! #Matrículas2024 👉 https://s.mtrbio.com/aetufwrdtx  Ministerio de Educación Nacional de Colombia";"2024-12-23T15:36:28+0000";"2024-12-27T11:48:34+0000";""
"1";"171";"6";"45235597147_1017582870402349";"data";"data.*";"fetched (200)";"2025-04-22 07:21:48.068609";"Facebook:/<page-id>/posts";"El arte es una poderosa herramienta de expresión para los niños, niñas y adolescentes de El Tarra (Norte de Santander). 🎨 Así es como Darwin, un joven profesor de artes plásticas, le apuesta al #ImpulsoJuvenil para construir paz, desarrollo y fortalecer procesos culturales.    Este proyecto, junto a UNODC Región Andina y Cono Sur y #FAO busca aumentar la participación e incidencia de jóvenes en la protección de sus derechos, así como promover agendas juveniles en los planes de desarrollo locales, departamentales y nacionales para contribuir a la construcción de una paz sostenible y duradera, en asocio con 5ta con 5ta crew  y el apoyo de United Nations Peacebuilding  Fondo Multidonante de las Naciones Unidas para la Paz";"2024-12-21T14:02:41+0000";"2025-02-07T11:31:29+0000";""
"1";"172";"6";"45235597147_1016869850473651";"data";"data.*";"fetched (200)";"2025-04-22 07:21:48.068609";"Facebook:/<page-id>/posts";"Así se vivió la premiación de #TrazosDePaz 2.0, el concurso que busca que adolescentes y jóvenes apropien y promuevan los hallazgos y recomendaciones del informe final de la Comisión de la Verdad y encuentren en el arte una herramienta para la construcción de una Colombia en Paz.   Conoce la experiencia de los y las ganadores seleccionados entre 700 adolescentes y jóvenes de todo el país.  Embajada de Bélgica en Colombia Ambassade De France Colombie   Alianza Francesa Bogotá  Unión Europea en Colombia  Embajada Alemana - Alemania en Colombia  La Paz Querida  Goethe-Institut Kolumbien  Embajada de Canadá en Colombia  Comisión de la Verdad  Kroc Institute for International Peace Studies, University of Notre Dame";"2024-12-20T13:41:01+0000";"2024-12-20T13:41:01+0000";""
